{
  "path" : "demo1",
  "label" : "demo1",
  "orePatches" : [ {
    "cx" : 39,
    "cy" : 37,
    "radius" : 3,
    "ore" : "alloy_gear"
  }, {
    "cx" : 30,
    "cy" : 46,
    "radius" : 3,
    "ore" : "alloy_gear"
  }, {
    "cx" : 30,
    "cy" : 31,
    "radius" : 3,
    "ore" : "alloy_gear"
  }, {
    "cx" : 30,
    "cy" : 38,
    "radius" : 3,
    "ore" : "alloy_gear"
  }, {
    "cx" : 33,
    "cy" : 32,
    "radius" : 3,
    "ore" : "alloy_gear"
  }, {
    "cx" : 34,
    "cy" : 41,
    "radius" : 3,
    "ore" : "alloy_gear"
  }, {
    "cx" : 34,
    "cy" : 39,
    "radius" : 3,
    "ore" : "alloy_gear"
  }, {
    "cx" : 33,
    "cy" : 35,
    "radius" : 3,
    "ore" : "alloy_gear"
  }, {
    "cx" : 36,
    "cy" : 34,
    "radius" : 3,
    "ore" : "alloy_gear"
  }, {
    "cx" : 27,
    "cy" : 35,
    "radius" : 3,
    "ore" : "alloy_gear"
  }, {
    "cx" : 30,
    "cy" : 41,
    "radius" : 3,
    "ore" : "alloy_gear"
  }, {
    "cx" : 26,
    "cy" : 39,
    "radius" : 3,
    "ore" : "alloy_gear"
  }, {
    "cx" : 26,
    "cy" : 41,
    "radius" : 3,
    "ore" : "alloy_gear"
  }, {
    "cx" : 24,
    "cy" : 89,
    "radius" : 3,
    "ore" : "coal"
  }, {
    "cx" : 24,
    "cy" : 89,
    "radius" : 3,
    "ore" : "coal"
  }, {
    "cx" : 24,
    "cy" : 86,
    "radius" : 3,
    "ore" : "coal"
  }, {
    "cx" : 24,
    "cy" : 86,
    "radius" : 3,
    "ore" : "coal"
  }, {
    "cx" : 24,
    "cy" : 78,
    "radius" : 3,
    "ore" : "coal"
  }, {
    "cx" : 21,
    "cy" : 79,
    "radius" : 3,
    "ore" : "coal"
  }, {
    "cx" : 21,
    "cy" : 81,
    "radius" : 3,
    "ore" : "coal"
  }, {
    "cx" : 23,
    "cy" : 81,
    "radius" : 3,
    "ore" : "coal"
  }, {
    "cx" : 25,
    "cy" : 82,
    "radius" : 3,
    "ore" : "coal"
  }, {
    "cx" : 26,
    "cy" : 82,
    "radius" : 3,
    "ore" : "coal"
  }, {
    "cx" : 26,
    "cy" : 83,
    "radius" : 3,
    "ore" : "coal"
  }, {
    "cx" : 22,
    "cy" : 83,
    "radius" : 3,
    "ore" : "coal"
  }, {
    "cx" : 22,
    "cy" : 83,
    "radius" : 3,
    "ore" : "coal"
  }, {
    "cx" : 22,
    "cy" : 83,
    "radius" : 3,
    "ore" : "coal"
  }, {
    "cx" : 22,
    "cy" : 83,
    "radius" : 3,
    "ore" : "coal"
  }, {
    "cx" : 21,
    "cy" : 83,
    "radius" : 3,
    "ore" : "coal"
  }, {
    "cx" : 21,
    "cy" : 84,
    "radius" : 3,
    "ore" : "coal"
  }, {
    "cx" : 20,
    "cy" : 88,
    "radius" : 3,
    "ore" : "coal"
  }, {
    "cx" : 70,
    "cy" : 32,
    "radius" : 3,
    "ore" : "bronze_ore"
  }, {
    "cx" : 74,
    "cy" : 36,
    "radius" : 3,
    "ore" : "bronze_ore"
  }, {
    "cx" : 79,
    "cy" : 36,
    "radius" : 3,
    "ore" : "bronze_ore"
  }, {
    "cx" : 79,
    "cy" : 33,
    "radius" : 3,
    "ore" : "bronze_ore"
  }, {
    "cx" : 76,
    "cy" : 33,
    "radius" : 3,
    "ore" : "bronze_ore"
  }, {
    "cx" : 76,
    "cy" : 33,
    "radius" : 3,
    "ore" : "bronze_ore"
  }, {
    "cx" : 76,
    "cy" : 29,
    "radius" : 3,
    "ore" : "bronze_ore"
  }, {
    "cx" : 75,
    "cy" : 29,
    "radius" : 3,
    "ore" : "bronze_ore"
  }, {
    "cx" : 70,
    "cy" : 29,
    "radius" : 3,
    "ore" : "bronze_ore"
  } ],
  "terrainPatches" : [ {
    "cx" : 60,
    "cy" : 77,
    "radius" : 3,
    "terrain" : "ROCK"
  }, {
    "cx" : 60,
    "cy" : 77,
    "radius" : 3,
    "terrain" : "ROCK"
  }, {
    "cx" : 60,
    "cy" : 67,
    "radius" : 3,
    "terrain" : "ROCK"
  }, {
    "cx" : 60,
    "cy" : 66,
    "radius" : 3,
    "terrain" : "ROCK"
  }, {
    "cx" : 60,
    "cy" : 57,
    "radius" : 3,
    "terrain" : "ROCK"
  }, {
    "cx" : 60,
    "cy" : 57,
    "radius" : 3,
    "terrain" : "ROCK"
  }, {
    "cx" : 60,
    "cy" : 57,
    "radius" : 3,
    "terrain" : "ROCK"
  }, {
    "cx" : 60,
    "cy" : 63,
    "radius" : 3,
    "terrain" : "ROCK"
  }, {
    "cx" : 66,
    "cy" : 63,
    "radius" : 3,
    "terrain" : "ROCK"
  }, {
    "cx" : 66,
    "cy" : 62,
    "radius" : 3,
    "terrain" : "ROCK"
  }, {
    "cx" : 64,
    "cy" : 62,
    "radius" : 3,
    "terrain" : "ROCK"
  }, {
    "cx" : 64,
    "cy" : 62,
    "radius" : 3,
    "terrain" : "ROCK"
  }, {
    "cx" : 64,
    "cy" : 63,
    "radius" : 3,
    "terrain" : "ROCK"
  }, {
    "cx" : 64,
    "cy" : 63,
    "radius" : 3,
    "terrain" : "ROCK"
  }, {
    "cx" : 64,
    "cy" : 63,
    "radius" : 3,
    "terrain" : "ROCK"
  }, {
    "cx" : 64,
    "cy" : 70,
    "radius" : 3,
    "terrain" : "ROCK"
  }, {
    "cx" : 64,
    "cy" : 72,
    "radius" : 3,
    "terrain" : "ROCK"
  }, {
    "cx" : 59,
    "cy" : 72,
    "radius" : 3,
    "terrain" : "ROCK"
  }, {
    "cx" : 59,
    "cy" : 71,
    "radius" : 3,
    "terrain" : "ROCK"
  }, {
    "cx" : 71,
    "cy" : 70,
    "radius" : 3,
    "terrain" : "ROCK"
  }, {
    "cx" : 63,
    "cy" : 66,
    "radius" : 3,
    "terrain" : "ROCK"
  }, {
    "cx" : 67,
    "cy" : 67,
    "radius" : 3,
    "terrain" : "ROCK"
  }, {
    "cx" : 67,
    "cy" : 75,
    "radius" : 3,
    "terrain" : "ROCK"
  } ]
}